Paraíba,23021862,"Casa à beira-mar, c/piscina e WI FI em Pitimbu/PB",Casa em Praia dos Mariscos,entire_home,746,4.87,71,-7.47796,-34.81271,Preferido dos hóspedes,"Casa mobiliada à beira-mar, com dois pavimentos,contendo no ANDAR INFERIOR: terraço, sala para dois ambientes, hall, 01 suíte (com ar-condicionado), 01 banheiro social, copa/cozinha, área de serviço e despensa. ANDAR SUPERIOR contendo 03 suítes (todas, com ar-condicionado), rouparia e área de circulação<br /><br />ÁREA EXTERNA: piscina, jardim gramado com 02 coqueiros, quiosque e vaga para 04 carros.<br /><br />O imóvel encontra-se todo equipado.","['10 camas', '4 quartos', '4 banheiros e meio', '2 camas de casal', '6 camas de solteiro', 'mais', 'A limpeza recebeu uma avaliação de 4,8 estrelas, de um máximo de 5']","['https://a0.muscache.com/im/pictures/02d3e2fc-521f-47a9-a09b-491c6d45db40.jpg?im_w=720', 'https://a0.muscache.com/im/pictures/1573107a-2c74-4b74-9931-927d7c51fd98.jpg?im_w=720', 'https://a0.muscache.com/im/pictures/f632184b-9bee-4f85-98bb-fc557a45bf2c.jpg?im_w=720', 'https://a0.muscache.com/im/pictures/3275871d-89a7-4630-ad66-5ce09956ab05.jpg?im_w=720', 'https://a0.muscache.com/im/pictures/732dccad-0914-45f8-b973-0a55c112424f.jpg?im_w=720', 'https://a0.muscache.com/im/pictures/5aeaaf4e-a2e2-4d4f-b5ce-3c1063a3cd89.jpg?im_w=720']"
Paraíba,53228926,Bangalô beira-mar na Praia de Coqueirinho PB,Bangalô em Conde,entire_home,620,4.99,87,-7.33495,-34.79507,Preferido dos hóspedes,Venha viver dias inesquecíveis na encantadora Praia de Coqueirinho no Litoral Sul da Paraíba. Nosso bangalô pé na areia  oferece para você e sua família momentos perfeitos onde o sol nasce primeiro.<br /><br />https://www.google.com/amp/s/g1.globo.com/google/amp/pb/paraiba/noticia/2018/12/31/praia-de-coqueirinho-no-conde-pb-oferece-falesias-e-aguas-cristalinas-aos-visitantes.ghtml,"['4 camas', '2 quartos', '2 banheiros', '2 camas queen', '2 camas de solteiro', 'A limpeza recebeu uma avaliação de 4,9 estrelas, de um máximo de 5']","['https://a0.muscache.com/im/pictures/miso/Hosting-53228926/original/2481aaec-a4c4-42e6-b9b4-961a313a14f3.jpeg?im_w=720', 'https://a0.muscache.com/im/pictures/miso/Hosting-53228926/original/dc4cdefb-9725-4bff-94f7-4c953d95ff87.jpeg?im_w=720', 'https://a0.muscache.com/im/pictures/miso/Hosting-53228926/original/5285bda7-9a5e-4cfb-a4f3-b75c2122368f.jpeg?im_w=720', 'https://a0.muscache.com/im/pictures/miso/Hosting-53228926/original/a5921095-0889-4cbc-9195-80af586edca6.jpeg?im_w=720', 'https://a0.muscache.com/im/pictures/miso/Hosting-53228926/original/ee6581a2-59b9-45a5-b335-b37e8b6dba6f.jpeg?im_w=720', 'https://a0.muscache.com/im/pictures/miso/Hosting-53228926/original/b549746f-902a-49c4-807c-ffc6abfda0b6.jpeg?im_w=720']"
Paraíba,934899325730035045,Flat Frente Mar com Jacuzzi,Apartamento em João Pessoa,entire_home,367,4.68,72,-7.088916663882019,-34.8343001723526,,"Flat moderno, recém construído, localizado no Jardim Oceania a 50m do mar e próximo dos melhores bares e restaurantes da cidade. Com 18m2, o espaço acomoda confortavelmente duas pessoas e possui cozinha completa para pequenas refeições, AC Split, TV Smart 42"", cama Queen Size,  frigobar e uma charmosa varanda com Jacuzzi para relaxar. Além disso, o prédio oferece coworking e um belíssimo rooftop com piscina de vista infinita para o mar. O seu destino perfeito para relaxar ou trabalhar.","['1 cama', '1 quarto', '1 banheiro', 'A limpeza recebeu uma avaliação de 4,8 estrelas, de um máximo de 5']","['https://a0.muscache.com/im/pictures/miso/Hosting-934899325730035045/original/0b48e021-1b2b-4061-8c4d-a4c9279bc350.jpeg?im_w=720', 'https://a0.muscache.com/im/pictures/miso/Hosting-934899325730035045/original/9d2c2264-38da-4c80-a7c2-06419b819d34.jpeg?im_w=720', 'https://a0.muscache.com/im/pictures/miso/Hosting-934899325730035045/original/57a53d23-531c-4050-896e-97c0b828811d.jpeg?im_w=720', 'https://a0.muscache.com/im/pictures/miso/Hosting-934899325730035045/original/db54ed2b-4679-4d11-949f-f4816c8d7b27.jpeg?im_w=720', 'https://a0.muscache.com/im/pictures/miso/Hosting-934899325730035045/original/b6ee477e-1958-47f6-ad5f-c366837df0fc.jpeg?im_w=720', 'https://a0.muscache.com/im/pictures/miso/Hosting-934899325730035045/original/a5a50d0b-bc47-4228-9e90-74d0fe922bce.jpeg?im_w=720']"
Paraíba,902152774013443262,"Flat Get One, perto da praia. João Pessoa",Apartamento em João Pessoa,entire_home,141,4.95,93,-7.0886720311619635,-34.83442654766329,Preferido dos hóspedes,"Flat localizado na principal avenida do Bessa 50 metros da praia, padarias, restaurantes, bares, farmácia, academia ao redor.<br />O flat está equipado com:<br />- Ar condicionado<br />- Smart tv com Netflix, YouTube.<br />- Frigobar<br />- cooktop por indução<br />- Todos utensílios para cozinha<br />- Micro-ondas<br />- Copos, xícaras, louças, panela e talheres<br />- Ferro de passar<br />- Secador de cabelo<br />-1 cama de casal<br />- 1 colchão para abrir no chão <br /><br />Áreas comuns:<br />- Coworking<br />- Lavanderia<br />- Espaço gourmet<br />- Piscina","['1 cama', '1 quarto', '1 banheiro', 'A limpeza recebeu uma avaliação de 5 estrelas, de um máximo de 5']","['https://a0.muscache.com/im/pictures/miso/Hosting-902152774013443262/original/5b653dd4-0e5a-42d0-a8a9-31cb4a024288.jpeg?im_w=720', 'https://a0.muscache.com/im/pictures/miso/Hosting-902152774013443262/original/300f9986-09f2-41d9-b403-864610533dec.jpeg?im_w=720', 'https://a0.muscache.com/im/pictures/miso/Hosting-902152774013443262/original/dd4741d9-e088-4953-8b42-88ff800da4c8.jpeg?im_w=720', 'https://a0.muscache.com/im/pictures/miso/Hosting-902152774013443262/original/82ade568-4d10-443f-8110-ccdf6d93af23.jpeg?im_w=720', 'https://a0.muscache.com/im/pictures/miso/Hosting-902152774013443262/original/ffa55c87-39c1-441d-9129-807389e6b21a.jpeg?im_w=720', 'https://a0.muscache.com/im/pictures/miso/Hosting-902152774013443262/original/111672dc-2871-40f1-8b13-84fe4fcfce60.jpeg?im_w=720']"
Paraíba,782656568928356559,Grey House/ casa frente pro mar,Casa em Conde,entire_home,616,4.8,25,-7.2951166,-34.8020181,Preferido dos hóspedes,"Casa de frente pro belo mar da praia de Carapibus.<br /><br />Nossa casa dispõe de quatro quartos*, todos com ar condicionado e banheiro. <br />Área coberta na piscina com vista para o mar, contendo: mesa, freezer, churrasqueira, e banheiro masculino e feminino. <br />Além de sala, Smartv, cozinha, rede Wi-Fi e estacionamento para seis carros.<br /><br />*roupas de cama e banho em todos os quartos.<br /><br />O número máximo de pessoas é de 12 pessoas. <br /><br />Venha relaxar e/ou curtir com os amigos e familiares na GREY House.<br /><br /><b>O espaço</b><br />-Cada quarto tem uma cama queen e disponibilizamos (caso seja necessário) até 4 colchões de solteiro;<br />-Todos os quartos tem banheiro, porém, dois quartos tem banheiro compartilhado entre eles, e os outros dois são suítes;<br />- Roupas de cama: lençol de elástico (colchão), colcha cobre leito e dois travesseiros;<br />- Roupa de banho: cada quarto  duas toalhas; <br />-Cozinha completa: liquidificador, sanduicheira, cafeteira, microondas, cooktop (não temos forno), talheres, pratos, copos, panelas;<br />- Wi-Fi tanto na área externa da casa,  como interna;<br />- piscina com área funda (1,40m) e prainha (0,35cm);<br />- não temos lavanderia <br />- temos mais duas casas ao lado, caso precise de mais quartos.<br /><br /><b>Outras observações</b><br />Cobramos taxa de Energia.<br />R$ 1,00 POR KWH CONSUMIDO","['4 camas', '4 quartos', '3 banheiros e meio', 'A limpeza recebeu uma avaliação de 4,7 estrelas, de um máximo de 5']","['https://a0.muscache.com/im/pictures/hosting/Hosting-782656568928356559/original/2eb6886c-1836-4279-9b14-6eeec76613c4.jpeg?im_w=720', 'https://a0.muscache.com/im/pictures/miso/Hosting-782656568928356559/original/176a4904-d63f-4148-b241-a1788179e68a.jpeg?im_w=720', 'https://a0.muscache.com/im/pictures/miso/Hosting-782656568928356559/original/754a45e9-51b2-42a7-9f0a-103b994a911f.jpeg?im_w=720', 'https://a0.muscache.com/im/pictures/hosting/Hosting-782656568928356559/original/3b555933-2d92-43a2-a3ba-d7bebc2eedc0.jpeg?im_w=720', 'https://a0.muscache.com/im/pictures/hosting/Hosting-782656568928356559/original/825f6bd3-7dfd-459a-b841-6579fc0fb9f3.jpeg?im_w=720', 'https://a0.muscache.com/im/pictures/hosting/Hosting-782656568928356559/original/12913778-8b91-44d4-b203-c5557a0b7bf4.jpeg?im_w=720']"
Paraíba,697254818351432030,Casa Jacumã com piscina e área gourmet,Casa em Conde,entire_home,970,4.94,17,-7.30495,-34.80919,Preferido dos hóspedes,"Casa com área de churrasqueira, piscina e a 5 minutos da praia Tabatinga 1, a praia mais linda do litoral sul da Paraíba.","['9 camas', '5 quartos', '7 banheiros', 'A limpeza recebeu uma avaliação de 4,8 estrelas, de um máximo de 5']","['https://a0.muscache.com/im/pictures/miso/Hosting-697254818351432030/original/af05957d-a94a-4e88-bcdb-36aa333122cd.jpeg?im_w=720', 'https://a0.muscache.com/im/pictures/miso/Hosting-697254818351432030/original/b04b6bec-bbaf-4d92-b0ba-8abbd97d6f15.jpeg?im_w=720', 'https://a0.muscache.com/im/pictures/miso/Hosting-697254818351432030/original/6811e695-3f4c-4a6f-ace4-76f0917023ac.jpeg?im_w=720', 'https://a0.muscache.com/im/pictures/miso/Hosting-697254818351432030/original/10d672b1-5b5c-44e9-b987-5794a8c7a620.jpeg?im_w=720', 'https://a0.muscache.com/im/pictures/miso/Hosting-697254818351432030/original/694c6126-cc67-4215-9ece-58e320684467.jpeg?im_w=720', 'https://a0.muscache.com/im/pictures/miso/Hosting-697254818351432030/original/2273beda-91a9-4e99-912f-100a7cffd9cd.jpeg?im_w=720']"
Paraíba,971712918824891176,Oka Chalé: Um ninho romântico.,Casa de cúpula em Araruna,entire_home,350,5.0,27,-6.458461,-35.66771,Preferido dos hóspedes,"Reconecte-se à natureza neste lugar inesquecível.<br />A Oka Chalé na Pedra da Boca tem uma proposta imersiva onde sua arquitetura se integra com o ambiente que o cerca. Seu desing é inspirado em materiais naturais oferecendo todo o conforto interno com cama ultraconfortável, cozinha funcional e um banheiro completo com a experiência única de banhar-se sentindo a paisagem à sua frente. Tudo isso no lugar mais emblemático do destino da Pedra da Boca. Fácil acesso a trilhas e experiências de aventura.","['1 cama', '1 quarto', '1 banheiro', 'A limpeza recebeu uma avaliação de 5 estrelas, de um máximo de 5']","['https://a0.muscache.com/im/pictures/miso/Hosting-971712918824891176/original/eb577764-76e3-4723-8d19-45dcc9aa80d1.jpeg?im_w=720', 'https://a0.muscache.com/im/pictures/miso/Hosting-971712918824891176/original/416bfa5d-45a0-493b-8a6b-ae920c136607.jpeg?im_w=720', 'https://a0.muscache.com/im/pictures/miso/Hosting-971712918824891176/original/daf030c0-41c7-4da5-b1a7-f472cbea2f5a.jpeg?im_w=720', 'https://a0.muscache.com/im/pictures/hosting/Hosting-U3RheVN1cHBseUxpc3Rpbmc6OTcxNzEyOTE4ODI0ODkxMTc2/original/4b0f6d76-6453-47a4-8a1e-162db666e044.jpeg?im_w=720', 'https://a0.muscache.com/im/pictures/hosting/Hosting-U3RheVN1cHBseUxpc3Rpbmc6OTcxNzEyOTE4ODI0ODkxMTc2/original/80a85098-e7ec-4fdf-9bdb-89ef8a0de96d.jpeg?im_w=720', 'https://a0.muscache.com/im/pictures/miso/Hosting-971712918824891176/original/fb9d7e45-082d-4887-834c-33347d066d2e.jpeg?im_w=720']"
Paraíba,50172744,Tabatinga Residence Flat Nord Luxxor - Pé na areia,Apartamento em Conde,entire_home,255,4.86,72,-7.31387,-34.80355,Preferido dos hóspedes,"Flat muito confortável ao melhor estilo ""pé na areia"" na linda praia de Tabatinga.<br /><br />Sinta-se bem, confortável e em contato com a natureza, priorizando a comodidade e a segurança!<br /><br />O lugar é ideal para 2 adultos e 2 crianças e dispõe do melhor para os seus momentos de relaxamento!","['2 camas', '1 quarto', '1 banheiro', '1 cama queen', '1 sofá-cama', 'A limpeza recebeu uma avaliação de 5 estrelas, de um máximo de 5']","['https://a0.muscache.com/im/pictures/83e95155-bbae-47c4-8909-27454446998f.jpg?im_w=720', 'https://a0.muscache.com/im/pictures/975a0e60-0d22-423a-baf6-e639144d813b.jpg?im_w=720', 'https://a0.muscache.com/im/pictures/d9fe41cf-2e18-4699-8dcd-d74eef53b7c3.jpg?im_w=720', 'https://a0.muscache.com/im/pictures/3398ee92-4c7e-4eaf-aea0-40aa76023818.jpg?im_w=720', 'https://a0.muscache.com/im/pictures/61c5ce9f-5ed7-40e4-9347-fd25d0c60a60.jpg?im_w=720', 'https://a0.muscache.com/im/pictures/ca82e362-19c1-4760-be4f-39465bc46a97.jpg?im_w=720']"
Paraíba,949096507158423993,"Casa à Beira-mar, com piscina",Casa em Pitimbu,entire_home,746,5.0,8,-7.493448028680066,-34.81511256380762,Superhost,"Esta casa é um refúgio perfeito para relaxar, rejuvenescer e criar memórias preciosas com seus entes queridos.<br />Nossa casa é pé na areia e a praia é calma e com piscinas naturais. Está idealmente situada na divisa de Recife e João Pessoa e a poucos minutos das  lindas praias de Coqueirinho e Tambaba e de Praia Bela, onde se encontram bugres e triciclos para alugar, com visitas aos paradisíacos estuários e falésias da região.<br />Para maior conforto, fornecemos roupas de cama, com troca semanal.","['9 camas', '4 quartos', '5 banheiros', 'A limpeza recebeu uma avaliação de 4,9 estrelas, de um máximo de 5']","['https://a0.muscache.com/im/pictures/miso/Hosting-949096507158423993/original/26ca1a73-516d-44a8-8653-0ff792916dfa.jpeg?im_w=720', 'https://a0.muscache.com/im/pictures/miso/Hosting-949096507158423993/original/68888aea-31bd-4ca1-a09e-ddb76c0ad85e.jpeg?im_w=720', 'https://a0.muscache.com/im/pictures/miso/Hosting-949096507158423993/original/fc0b430d-a833-4227-9ef2-cfa842393eb0.jpeg?im_w=720', 'https://a0.muscache.com/im/pictures/miso/Hosting-949096507158423993/original/19d6d543-01c0-4460-9ffa-ac7cd673872a.jpeg?im_w=720', 'https://a0.muscache.com/im/pictures/miso/Hosting-949096507158423993/original/ee137891-6c7c-4a15-b41d-7c4866fc08f6.jpeg?im_w=720', 'https://a0.muscache.com/im/pictures/miso/Hosting-949096507158423993/original/0d12e2b9-fd12-4a76-bd55-c6776875cff4.jpeg?im_w=720']"
Paraíba,51822709,Linda hospedagem em condomínio,Casa em Barra do Cunhaú,entire_home,208,4.89,104,-6.3137078285217285,-35.042640686035156,Preferido dos hóspedes,"Barra do Cunhaú pode se orgulhar de belas vistas pontilhadas de palmeiras e rios de águas verdes. Na praia, os arrecifes formam piscinas naturais entre a foz dos rios Catú e Curimataú excelentes para banho, tendo como pano de fundo as dunas de areia.<br /><br /><b>O espaço</b><br />Este lindo condomínio fica no prestigioso Morro da Villa Brazil Hill, um sofisticado condominio com vista para o mar e também do rio. A casa com 83 m2, inclui dois quartos situados no andar superior, os 2 quartos possuem  um grande guarda roupas embutido,  ar condicionado em ambos os quartos, cafeteira elétrica, torradeira, sanduicheira, geladeira com congelador e micro-ondas. Lençóis e toalhas também estão disponíveis.<br />Lembre-o que a LAVADORA NÃO ESTÁ DISPONÍVEL para hóspedes. NÃO INCLUSO<br />Uma linda TV para curtir um programa no fim de tarde ou a noite. Informo que NAO HA CANAIS ABERTO somente netflix.<br /><br />O condomínio possui 2 piscinas, churrasqueira externa, cadeiras, guarda-sóis, ducha e 2 banheiros.<br /><br />Um maravilhoso lar longe de casa, este condomínio fica a menos de 6km da Praia da Pipa, Tibau do Sul e outras cidades pequenas. Na Barra do Cunhau você encontra restaurantes, mercadinho, farmácias, e, lojinhas, etc.<br /><br />O sol brilha 300 dias por ano.<br /><br />Se quer aprender ou praticar Kitesurf, este é o seu destino. A região da Barra do Cunhau é um dos melhores locais para este esporte incrível com algumas escolas disponíveis.<br /><br /><b>Acesso do hóspede</b><br />Todas as áreas do condomínio<br />2 piscinas<br />Churrasqueira<br />Mesas, espreguiçadeiras e guarda-chuvas ao ar livre<br />Estacionamento<br />Jardim<br />2 banheiros na area da piscina <br />Ducha<br /><br /><b>Outras observações</b><br />Taxas serão alteradas durante feriados e carnaval, favor contatar me para mais informações antes de fazer a reserva, grato.","['4 camas', '2 quartos', '2 banheiros', '1 cama queen', '2 camas de solteiro', 'mais', 'A limpeza recebeu uma avaliação de 4,9 estrelas, de um máximo de 5']","['https://a0.muscache.com/im/pictures/36509e75-bbff-4c5a-92fa-3f55c8131495.jpg?im_w=720', 'https://a0.muscache.com/im/pictures/d2123136-7df2-4955-8342-0a6be7bd705f.jpg?im_w=720', 'https://a0.muscache.com/im/pictures/fc3aaba3-22c2-4b67-b2e6-785e33b47c45.jpg?im_w=720', 'https://a0.muscache.com/im/pictures/5b17c3ed-dcce-495f-99b9-0e901eb178ea.jpg?im_w=720', 'https://a0.muscache.com/im/pictures/c2d1f763-7434-4c15-b22e-4f0e25da14f4.jpg?im_w=720', 'https://a0.muscache.com/im/pictures/miso/Hosting-51822709/original/05d278a8-7514-4ef9-ac79-0777b3d305be.jpeg?im_w=720']"
Paraíba,1073963761209252398,Tabatinga Residence - Conde PB,Apartamento em Conde,entire_home,228,5.0,6,-7.313406512422678,-34.80273550783542,Preferido dos hóspedes,"Fica a beira mar de Tabatinga 2, uma paradisíaca e cercada por falésias, 30 km de João Pessoa/PB. É bem espaçoso, possui 48 metros quadrados, e uma vista lateral para o mar. O quarto casal temos o guarda-roupas, ar-condicionado, TV smart, cama casal e 2 colchões no chão, lençóis e toalhas e um banheiro suíte. Na sala uma TV smart, sofá cama e ventilador. Na cozinha você terá todos os utensílios para prepara uma deliciosa comida, geladeira, cooktop, sanduicheira, panelas, copos, pratos.","['1 cama', '1 quarto', '1 banheiro', 'A limpeza recebeu uma avaliação de 5 estrelas, de um máximo de 5']","['https://a0.muscache.com/im/pictures/miso/Hosting-1073963761209252398/original/6359f62f-63f6-49ea-82b5-53127e9d02de.jpeg?im_w=720', 'https://a0.muscache.com/im/pictures/miso/Hosting-1073963761209252398/original/d8b02871-37eb-4631-a9f9-09234ebb08a8.jpeg?im_w=720', 'https://a0.muscache.com/im/pictures/miso/Hosting-1073963761209252398/original/a98d26a5-6ebc-4726-9ec9-5db5882f57c7.jpeg?im_w=720', 'https://a0.muscache.com/im/pictures/miso/Hosting-1073963761209252398/original/a0b671c9-6bbc-48c9-94f2-a2bf7bfb900e.jpeg?im_w=720', 'https://a0.muscache.com/im/pictures/miso/Hosting-1073963761209252398/original/868c889c-3c1c-463e-b11b-2d2c81d797e6.jpeg?im_w=720', 'https://a0.muscache.com/im/pictures/miso/Hosting-1073963761209252398/original/c272d171-922d-458c-adef-ea6f70b3c5f7.jpeg?im_w=720']"
Paraíba,52756909,Bangalô em Lucena-Pb no Victory Marine a beira mar,Bangalô em Lucena,entire_home,495,4.97,29,-6.90537,-34.85941,Preferido dos hóspedes,"Leve toda a família a este ótimo lugar com muito espaço para se divertir.<br /><br /><b>O espaço</b><br />Toda a área de lazer do condomínio <br />A praia é excelente, quando a maré baixa fica uma piscina com vários bancos de areia<br /><br /><b>Outras observações</b><br />Temos Wi-Fi <br />Um terraço com sala de TV e espaço gourmet, com freezer, fogão , pia , churrasqueira e<br />Mesa grande com cadeiras","['13 camas', '6 quartos', '3 banheiros', '1 cama king', '3 camas de casal', 'mais', 'A limpeza recebeu uma avaliação de 4,8 estrelas, de um máximo de 5']","['https://a0.muscache.com/im/pictures/miso/Hosting-52756909/original/4b957d17-c27a-4cdc-bd3e-b6abc6dbe900.jpeg?im_w=720', 'https://a0.muscache.com/im/pictures/miso/Hosting-52756909/original/53c593e2-c0ea-48ab-bc66-9e74e6a17b49.jpeg?im_w=720', 'https://a0.muscache.com/im/pictures/miso/Hosting-52756909/original/ee7af1db-7b01-491b-bd81-25d101cf8764.jpeg?im_w=720', 'https://a0.muscache.com/im/pictures/aabba7b8-2d47-43a7-917a-d1ad555d67b6.jpg?im_w=720', 'https://a0.muscache.com/im/pictures/miso/Hosting-52756909/original/8e9d94f2-ad09-417c-bd66-b07338886ba2.jpeg?im_w=720', 'https://a0.muscache.com/im/pictures/miso/Hosting-52756909/original/8953e52b-6c4a-4863-b22b-5e3da085eaa7.jpeg?im_w=720']"
Paraíba,740471318120246014,Refúgio à Beira-Mar com Café da Manhã,Apartamento em Conde,entire_home,300,4.98,42,-7.3009716,-34.799973,Preferido dos hóspedes,"Seja bem-vindo a este apartamento perfeito para aqueles que buscam um refúgio próximo ao mar para descansar. Ao sair do prédio, você terá o privilégio de se deparar com uma das mais belas praias de todo o litoral da Paraíba.<br />Ao escolher ficar conosco, você terá acesso à incrível área de lazer da Pousada Enseada do Sol, bem como desfrutará de um café da manhã delicioso e revigorante servido na pousada. E o melhor? A pousada está a meros 50 metros de distância do nosso edifício.<br /><br /><b>O espaço</b><br />Dentro do nosso edifício, você encontrará uma piscina com uma vista panorâmica que beira o incrível. Já na Pousada Enseada do Sol, uma área de lazer absolutamente espetacular o aguarda, com duas piscinas - incluindo uma para os pequenos - além de toboágua, redes para relaxamento, salão de jogos e vistas panorâmicas de tirar o fôlego. Vale ressaltar o bar e restaurante da pousada, onde uma seleção de pratos e bebidas excepcionais aguardam para saciar seu paladar.<br /><br /><b>Acesso do hóspede</b><br />Os hóspedes têm acesso a: <br />* Área de lazer do edifício: piscina e área de apoio da piscina.<br />* Salão de jogos.<br />* Área de lazer da Pousada Enseada do Sol. <br />* O salão de festas do edifício não<br />está disponível para uso.<br /><br /><b>Outras observações</b><br />* O check-in e check-out são realizados na Pousada Enseada do Sol.<br />* O café da manhã é servido na Pousada Enseada do Sol.<br />* Estacionamento gratuito disponível na Pousada Enseada do Sol","['1 cama', '1 quarto', '1 banheiro', '1 cama de casal', 'A limpeza recebeu uma avaliação de 5 estrelas, de um máximo de 5']","['https://a0.muscache.com/im/pictures/5ba4717e-bbf8-4e61-816c-3990b0ad10dd.jpg?im_w=720', 'https://a0.muscache.com/im/pictures/89b9874d-82ef-4ed3-92fb-2761675edf43.jpg?im_w=720', 'https://a0.muscache.com/im/pictures/dc7d1fe2-3808-407d-93fa-37bdd790cbf5.jpg?im_w=720', 'https://a0.muscache.com/im/pictures/ca93f272-1ca4-4bf1-bbdf-7dd144dd8442.jpg?im_w=720', 'https://a0.muscache.com/im/pictures/1aa1ce2f-df45-4962-a4b1-be1aec311459.jpg?im_w=720', 'https://a0.muscache.com/im/pictures/aa1323ef-abf7-4406-9cbc-7f8bc41edbda.jpg?im_w=720']"
Paraíba,711676070960430323,Loft de luxo pé na areia - com jacuzzi,Loft em João Pessoa,entire_home,550,4.96,56,-7.08865,-34.83399,Preferido dos hóspedes,"Loft de luxo pé na areia na beira mar da praia do Bessa. Ambiente tranquilo, ventilado, com jacuzzi e área de lazer privativa. O prédio conta com piscina de vidro da cobertura, área gourmet, sala de poker, sala de reunião, coworking, lavanderia e academia.","['2 camas', '1 quarto', '1 banheiro', '1 cama queen', '1 sofá-cama', 'A limpeza recebeu uma avaliação de 4,9 estrelas, de um máximo de 5']","['https://a0.muscache.com/im/pictures/ae945416-0905-44e0-8da0-e30a40af061f.jpg?im_w=720', 'https://a0.muscache.com/im/pictures/3a4c0dd5-bf18-4c84-9358-f1669b692e20.jpg?im_w=720', 'https://a0.muscache.com/im/pictures/e387a74e-2694-4722-8b99-52002702748a.jpg?im_w=720', 'https://a0.muscache.com/im/pictures/11999653-620a-47df-ae90-6f3d5893af36.jpg?im_w=720', 'https://a0.muscache.com/im/pictures/miso/Hosting-711676070960430323/original/f91f0a0f-29e6-4016-8c9d-18e937117f41.jpeg?im_w=720', 'https://a0.muscache.com/im/pictures/miso/Hosting-711676070960430323/original/e3c02dd3-5222-477a-a75a-02dd60eeca49.jpeg?im_w=720']"
Paraíba,41241289,Platô da Nascente (chalés serranos com vista),Microcasa em Cerro Corá,entire_home,274,4.98,65,-6.03467,-36.38876,Preferido dos hóspedes,"Chalé estilo aquário em mirante com vista privilegiada para a cidade de Cerro Corá/RN. Tenha a oportunidade de curtir de dia a região do Geoparque Seridó e a noite aproveitar agradável clima serrano em pleno semiárido potiguar.<br /><br /><b>O espaço</b><br />Chalé em mirante, sendo 04 pessoas a capacidade máxima de cada chalé. O chalé conta com deck suspenso coberto (com mesa, cadeiras e rede), quarto com cama de casal queen, bicama (equivalente a duas de solteiro), ventilador, cozinha americana (com geladeira, fogão cooktop, sanduicheira, liquidificador e utensílios básicos), banheiro privativo com clarabóia e fogo de chão exclusivo, além de área externa com comedouros de pássaros, meliponário, mariposário e espaços para imersão na natureza. Aos sábados, para maior conforto dos nossos hóspedes, funciona na propriedade o Platônico Pub, barzinho com diversa gama de petiscos e bebidas para aproveitarem ainda mais nossa vista privilegiada e o verdadeiro clima serrano potiguar.<br /><br /><b>Outras observações</b><br />Recomendamos o uso de roupa de frio para curtir o clima à noite, em especial na área externa do chalé.<br /><br />Uma única criança até 05 anos de idade será gratuita, tendo mais de uma, as demais serão cobradas no valor normal do hóspede extra. O chalé acomoda até 04 pessoas, incluindo crianças.","['2 camas', '1 quarto', '1 banheiro', '1 cama queen', '1 sofá-cama', 'A limpeza recebeu uma avaliação de 4,9 estrelas, de um máximo de 5']","['https://a0.muscache.com/im/pictures/3b9506f4-a880-4178-8a56-316208d71cd8.jpg?im_w=720', 'https://a0.muscache.com/im/pictures/2266f782-3cb2-4005-9170-ecd79296cea9.jpg?im_w=720', 'https://a0.muscache.com/im/pictures/miso/Hosting-41241289/original/3da25c2d-8df0-4342-bba3-3992659dd899.jpeg?im_w=720', 'https://a0.muscache.com/im/pictures/miso/Hosting-41241289/original/6fdb8a6b-0316-47ee-93ea-c83b5920d70a.jpeg?im_w=720', 'https://a0.muscache.com/im/pictures/miso/Hosting-41241289/original/98d92f2f-8f93-4255-9aa8-fcdb17745fa9.jpeg?im_w=720', 'https://a0.muscache.com/im/pictures/miso/Hosting-41241289/original/dfe90eeb-ab96-482f-b520-f31e40525b0c.jpeg?im_w=720']"
