Goiás,42671004,"Casa-barco ""Faroeste Caboclo""",Casa flutuante em Brasília,entire_home,531,4.85,149,-15.77806,-47.86141,Superhost,"Curta o Lago Paranoá em grande estilo numa embarcação flutuante autônoma, completa e confortável. Durante o dia você pode fazer churrasco, nadar, pescar e praticar esportes náuticos. No fim da tarde contemple o belo pôr do sol do lago. Durante a noite você pode fazer um jantar sob as aguas mansas à luz da lua e das estrelas, com fogueira, vinho, fondue e grelhados. Possui dormitório, banheiro privativo, cozinha compacta, estação de trabalho e deck com área de estar e espreguiçadeiras.<br /><br /><b>O espaço</b><br />A house boat é um barco, que fica amarrado na extemidade de um pier, voltado para o centro do lago. Você NÃO pode se locomover com ele durante a estadia. O espaço inteiro fica a sua disposição. Dentro do conteiner há cama de casal, colchão extra, armario interno, estante, geladeira, banheiro e cozinha compacta com microondas, forno e fogão elétrico. No deck externo tem mesa e poltronas de madeira fixas, espreguiçadeiras, armário externo, churrasqueira e base para fazer o fogueira. Fornecemos 2 caiaques e 1 bote de alumínio para o hospede passear no lago se quiser. O barco tem documento emitido pela Marinha.<br /><br /><b>Acesso do hóspede</b><br />A House Boat fica dentro da marina Brasília Motonautica Clube, dentro do lago, amarrada na extremidade de um pier. O espaço tem portaria 24h e estacionamento interno ao lado do pier onde está a house boat. Para entrar na house boat basta caminhar pelo pier, acessível a qualquer pessoa.<br /><br /><b>Outras observações</b><br />Pode deixar as portas e janelas abertas enquanto estiver no local porque é seguro e ninguém incomoda. Quando for sair é necessário trancar o Conteiner e todos os objetos móveis. Amarre o bote e os caiaques com corrente e cadeado durante a noite quando a house boat estiver fechada e quando sair. A marina é privada, mas outra pessoas circulam dentro dela. O Lago é público, de forma que não temos controle sobre a circulação de outras embarcações e pessoas no lago.","['2 camas', '1 quarto', '1 banheiro', '2 camas de casal', 'Ar-condicionado', 'Wi-Fi', 'Estacionamento gratuito', 'Cozinha', 'A limpeza recebeu uma avaliação de 4,9 estrelas, de um máximo de 5']","['https://a0.muscache.com/im/pictures/miso/Hosting-42671004/original/13b221b5-2935-4d2b-ae36-60e2e358714f.jpeg?im_w=720', 'https://a0.muscache.com/im/pictures/miso/Hosting-42671004/original/05f28ae9-9cd5-4005-9b42-f9a064003755.jpeg?im_w=720', 'https://a0.muscache.com/im/pictures/miso/Hosting-42671004/original/98ee4f2d-6ef2-48f5-a78b-d8bfb25a2a00.jpeg?im_w=720', 'https://a0.muscache.com/im/pictures/miso/Hosting-42671004/original/6e12ec19-5f78-44a9-9937-7ba32123a1ea.jpeg?im_w=720', 'https://a0.muscache.com/im/pictures/miso/Hosting-42671004/original/db2c7cfa-768f-43a2-bf00-a6add3bbd40f.jpeg?im_w=720', 'https://a0.muscache.com/im/pictures/miso/Hosting-42671004/original/641c02b8-cb02-4ae3-b556-186a0934a099.jpeg?im_w=720']"
Goiás,600662852991230734,Casa do Lago,Casa em Jardim Esmeralda,entire_home,896,4.72,25,-15.84728,-48.97411,,"A casa  reúne tudo o que você precisa: piscina maior  e piscina menor aquecidas com energia solar, sauna lago, belíssimo paisagismo, área de churrasco, 4 quartos suítes, todos com ar-condicionado,TV, 1 suíte de serviço com cama de casal, Wi-Fi e estacionamento.<br /><br />OB: A energia elétrica  e água consumida durante a estadia será cobrada à parte. Roupa de cama e toalhas não esta incluso no valor da diária, é alugado e cobrado a parte.<br />Check-in à partir das 14:00H<br />Check-out as 10:00H<br /><br /><b>O espaço</b><br />3 suítes com uma cama casal duas de solteiro 1 suíte cama casal 1 de funcionário cama casal","['11 camas', '5 quartos', '6 banheiros', 'Ar-condicionado', 'Wi-Fi', 'Estacionamento gratuito', 'Cozinha', 'A limpeza recebeu uma avaliação de 4,6 estrelas, de um máximo de 5']","['https://a0.muscache.com/im/pictures/miso/Hosting-600662852991230734/original/e337f687-913b-4b44-8c24-e4ec95a7f1d1.jpeg?im_w=720', 'https://a0.muscache.com/im/pictures/miso/Hosting-600662852991230734/original/98dcc600-decc-4ff0-84b9-575883892317.jpeg?im_w=720', 'https://a0.muscache.com/im/pictures/miso/Hosting-600662852991230734/original/b6fb82d2-4e0f-41d2-9547-70af114a4d54.jpeg?im_w=720', 'https://a0.muscache.com/im/pictures/miso/Hosting-600662852991230734/original/76a66ccd-e2ad-4126-954f-a633c8ba0cef.jpeg?im_w=720', 'https://a0.muscache.com/im/pictures/miso/Hosting-600662852991230734/original/4edbdfcd-daff-470f-9ac2-c7b0b80fdd53.jpeg?im_w=720', 'https://a0.muscache.com/im/pictures/miso/Hosting-600662852991230734/original/ab5cf9a2-dc26-485d-83fe-50316118a71a.jpeg?im_w=720']"
Goiás,787822120620744072,"Chalé Beija-flor, venha viver essa experiência!",Casa em Alto Paraíso de Goiás,entire_home,258,5.0,30,-14.13845,-47.72023,Preferido dos hóspedes,"O chalé Beija-flor é uma hospedagem para quem busca contato com a natureza e apoia a idéia de auto sustentabilidade. localizado dentro da<br />RPPN Mata Funda, conta com energia fotovoltaica e aquecimento solar do banho.<br />Cercado pelo cerrado, temos um jardim com diversas plantas frutíferas e flores locais. E ao anoitecer temos um dos maiores espetáculos que a natureza nós oferece, um quadro de estrelas pintado no céu trazendo uma energia maravilhosa para essa casinha que você pode usar como sua!<br /><br /><b>O espaço</b><br />O espaço faz parte de um sonho meu desde que eu era criança, trabalhar com o turismo proporcionando momentos de felicidade e prazer ao invés de vender um produto físico. Toda a casa foi feita por minhas próprias mãos com o máximo de carinho para melhor atender você, que faz parte dessa história! VENHA VIVER ESSA EXPERIÊNCIA!!! <br /><br />AVISOS:<br /><br />1-PARA O BANHO CONTAMOS COM AQUECIMENTO SOLAR EXCLUSIVO, ESTANDO SUJEITO A OSCILAÇÕES DE ACORDO COM AS CONDIÇÕES CLIMATICAS. PERÍODO DE CHUVA (OUTUBRO A ABRIL)<br /><br />2-DURANTE O PERIODO DE CHUVA<br />DIFICULTA A VISUALIZAÇÃO DAS ESTRELAS E TAMBÉM A VISUALIZAÇÃO DO POR DO SOL CONFORME FOTOS DO ANUNCIO!<br /><br />3-POR ESTAR LOCALIZADA EM UMA ÁREA DE PRESERVAÇÃO AMBIENTAL, O CHALÉ PODE ESTAR SUJEITO A INSETOS E OUTROS ANIMAIS.<br /><br /><b>Acesso do hóspede</b><br />Acesso a cachoeira privativa na propriedade<br /><br /><b>Outras observações</b><br />O chalé se localiza no km72 da GO 239, ao entrar na fazenda são mais 1,3 km de estrada de terra!","['1 cama', '1 quarto', '1 banheiro', 'Estacionamento gratuito', 'Cozinha', 'A limpeza recebeu uma avaliação de 5 estrelas, de um máximo de 5']","['https://a0.muscache.com/im/pictures/e8fac168-f335-4ffb-b086-bc24d9853884.jpg?im_w=720', 'https://a0.muscache.com/im/pictures/e889fe3f-077f-4b7d-897d-e6312219bf98.jpg?im_w=720', 'https://a0.muscache.com/im/pictures/c6a17711-5b1d-47f4-91d7-7f7371cf7a80.jpg?im_w=720', 'https://a0.muscache.com/im/pictures/aedf5f63-0489-4486-8a03-0392ab4412a7.jpg?im_w=720', 'https://a0.muscache.com/im/pictures/0385d2f2-8545-4142-a7fb-31924b0df1e5.jpg?im_w=720', 'https://a0.muscache.com/im/pictures/2e52784a-980c-47a0-b5f6-1e9375b8c1e5.jpg?im_w=720']"
Goiás,850796775413705918,Chalé Encanto Cerrado,Chalé em Distrito Federal,entire_home,569,4.97,161,-15.95304,-48.19107,Preferido dos hóspedes,"SIGA-NOS NO |NSTAGRAM @ENCANTOCERRADO <br /><br />Nós do Encanto Cerrado preparamos tudo com amor e carinho para receber nossos hóspedes que buscam se reconectar com a natureza sem abrir mão do conforto.<br />Um chalé na natureza é o refúgio perfeito para se desconectar do mundo e se conectar ainda mais com a pessoa amada, criando um ambiente romântico em meio à beleza natural que os cerca.<br /><br /><b>O espaço</b><br />Nossa hospedagem foi totalmente planejada para o conforto do casal que procura se conectar com a natureza e desfrutar de momentos únicos sem deixar de lado o conforto e o luxo. <br /><br />A nossa área externa é composta por uma piscina para aqueles dias mais calorosos, com cadeiras em fibra sintética para tomar aquela boa e velha vitamina D, ganchos de rede para que você possa relaxar e uma fogueira para esquentar as suas noites e preparar o seu marshmallow.<br /><br />Não podemos deixar de citar a nossa área verde, com várias árvores frutíferas e plantas que realçam ainda mais a beleza do cerrado candango.<br /><br />Ahhh, e o que falar do nosso céu estrelado? Se você é um amante da astronomia o seu lugar perfeito é aqui!<br /><br />Já na parte interna você terá uma cozinha totalmente equipada para a preparação das suas refeições, eletrodomésticos que irão facilitar ainda mais o preparo das suas receitas e uma mesa de jantar que lhe permite fazer suas refeições admirando a nossa paisagem.<br /><br />E me diz o que há de melhor do que você tomar um banho com seu parceiro/a em um chuveiro duplo? O nosso banheiro é um espetáculo, bem espaçoso para uma melhor movimentação, e itens essenciais para sua higiene.<br /><br />Pode ter certeza que sua noite de sono estará garantida com uma maravilhosa cama queen, onde você poderá dormir e acordar contemplando a linda vista para o vale. Mas se você é daqueles que gosta de ambientes escuros, não se preocupe pois nosso chalé é completamente fechado com cortinas e blackouts 100% que irá permitir que você durma sem que a claridade lhe incomode.<br /><br />Não poderíamos esquecer da nossa hidromassagem, fala sério né!? Imagina só, você e seu companheiro admirando o mais lindo pôr do sol enquanto desfrutam de uma maravilhosa hidro. <br /><br />Lembramos também que somos pet friendly e teremos como sua anfitriã a nossa querida Encanto, uma linda cachorrinha que poderá fazer companhia ao seu bichinho que poderá usufruir de todo o espaço. <br /><br />Eu sei, eu sei eu poderia passar o dia inteiro falando sobre as maravilhas do nosso querido Encanto Cerrado e não faltaria adjetivos para descrever.<br /><br />Além de tudo isso contamos com serviços adicionais que são cobrados à parte, como por exemplo:<br /><br />Decorações românticas<br />Serviços de translado.<br /><br />É de total responsabilidade do hóspede que o chalé seja entregue com as louças lavadas e lixo recolhido.<br /><br />E também inúmeras comodidades como:<br /><br />Tv smart<br />Serviços de streaming (Netflix, Amazon, Hbo e etc.)<br />Wi-fi<br />Caixa de som bluetooth<br />Roupão e pantufas<br />Máquina de fondue<br />Cafeteira<br />Entre outros.<br /><br /><b>Acesso do hóspede</b><br />O acesso ao chalé é feito por 2,5Km de uma ótima e larga estrada de chão, que em condições climáticas da natureza poderá por alguns momentos dificultar um pouco o seu acesso. Já na chegada do nosso chalé contamos com um estacionamento bem espaçoso e algumas áreas em comum que ainda estão em fase de melhorias, como um lago artificial e um balanço para fotos. Até a chegada do chalé são 28 degraus bem tranquilo e iluminado. Na parte principal da nossa estrutura você poderá desfrutar de todo o espaço.<br /><br /><b>Outras observações</b><br />Lembramos que por se tratar de uma hospedagem em meio a natureza não podemos descartar a possibilidade de encontrar animais peçonhentos, mesmo que nunca vistos no local. Pedimos também a compreensão de todos pois a nossa intenção será sempre entregar o melhor para todos os nossos hóspedes, mas sabemos que imprevistos acontecem e que nem tudo poderá sair exatamente como esperava, mas garantimos que iremos dar o nosso melhor para que você se sinta maravilhosamente bem.","['1 banheiro', '1 cama queen', 'Ar-condicionado', 'Wi-Fi', 'Estacionamento gratuito', 'Cozinha', 'A limpeza recebeu uma avaliação de 5 estrelas, de um máximo de 5']","['https://a0.muscache.com/im/pictures/miso/Hosting-850796775413705918/original/a972db7d-5320-4b2f-9327-ac2ab1d3dbe6.jpeg?im_w=720', 'https://a0.muscache.com/im/pictures/miso/Hosting-850796775413705918/original/022a04af-b7e0-49d7-8140-7d63b26acd2f.jpeg?im_w=720', 'https://a0.muscache.com/im/pictures/miso/Hosting-850796775413705918/original/1e391a38-a127-4e85-98ec-4d18f6838ead.jpeg?im_w=720', 'https://a0.muscache.com/im/pictures/miso/Hosting-850796775413705918/original/ce3aad73-a986-4c55-987e-f73c8edd21a2.jpeg?im_w=720', 'https://a0.muscache.com/im/pictures/miso/Hosting-850796775413705918/original/cbe80347-5373-4eb3-b140-cc71bd1d7587.jpeg?im_w=720', 'https://a0.muscache.com/im/pictures/miso/Hosting-850796775413705918/original/c64140fe-59c7-4969-9244-3a83882ecf21.jpeg?im_w=720']"
Goiás,43904489,Microcasa Árvore na beira do lago vista incrível,Quarto de hotel em SMLN,entire_home,1274,4.87,318,-15.78884,-47.80471,Superhost,"Microcasa madeira e beira do lago Paranoá, rústico, integrado a natureza e a topografia local, chegada lancha ou barco , Uber ou carro. Alta gastronomia disponível. Sauna úmida, piscina privativa aquecida temp média de 28 graus, ofuro e praça fogo. Vista inigualável. Atenção: compartimento vaso sanitário acessado escada e externo a casa. Chuveiro e pia interna casa, ar condicionado, Frigobar, Adega Climatizada, Cooktop 1 boca, Forno elétrico, Grill. Não indicado pessoas dificuldade locomoção.<br /><br /><b>O espaço</b><br />Nosso espaço proporciona uma experiencia rústica com um mix de glamping. Se desejar relaxar, tirar um momento a dois longe das preocupações da cidade, mas próximo dela é o local ideal. Se desejar acordar com os pássaros, receber ilustres visitas de macaquinhos, tucanos eventualmente até mesmo uma capivara, este é o local. Com originalidade e conforto. Uma experiência diferente do habitual.<br /><br /><b>Acesso do hóspede</b><br />O hóspede terá acesso por meio do lago podendo ser por meio próprio ou serviço de translado não incluso no valor da diária, um simples Uber de 15 minutos considerando o centro de Brasilia passando pela majestosa Ponte JK e a linda barragem do Paranoá ou carro próprio estacionado no terreno da casa a aproximadamente 50 metros da mesma. Nosso pier é em área pública e de acesso aberto, o Patú Anú não se responsabiliza pelas embarcações atracadas, equipamentos da mesma e nem pelos objetos em seu interior. Também não dispomos de estacionamento coberto, somente à sombras de árvores dentro de nosso terreno, sujeito a intempéries naturais.<br /><br />O acesso se dá por meio de escadas que são encaixadas de acordo com a topografia do local, em função disto não é apropriado para pessoas com dificuldade de locomoção ou cadeirantes. Não recomendamos também para crianças que já se locomovam sozinhas em função da proximidade lago que atinge grandes profundidades rapidamente, características da casa no que se refere a desníveis e guardacorpos. A Casa recebe apenas 2 pessoas.<br /><br /><b>Outras observações</b><br />Oferecemos uma experiência de imersão na natureza, os hóspedes poderão ter contato com macaquinhos, sarues e capivaras que temos na região. Oferecemos itens para finalização do seu café da manhã: pães, pão de queijo para assar, suco, queijo fatiado, presunto ou peito de peru fatiado, iogurte, granola, frutas, manteiga, doce de leite, geleia, leite, ovos (1 por dia por hospede) capsula café (1 unidade por dia por hospede), marshmallow para assar.","['1 cama', '1 quarto', '1 banheiro', '1 cama queen', 'Ar-condicionado', 'Wi-Fi', 'Estacionamento gratuito', 'Cozinha']","['https://a0.muscache.com/im/pictures/prohost-api/Hosting-43904489/original/e2dfaf0f-0562-45f6-a76a-56455e1e1777.jpeg?aki_policy=large', 'https://a0.muscache.com/im/pictures/prohost-api/Hosting-43904489/original/41b95937-40bb-4bba-b21e-2e51260530c2.jpeg?im_w=720', 'https://a0.muscache.com/im/pictures/prohost-api/Hosting-43904489/original/888aab2e-7949-4c0e-9c73-bfaf39fda55c.jpeg?im_w=720', 'https://a0.muscache.com/im/pictures/prohost-api/Hosting-43904489/original/318cb4e9-316e-4179-aedf-7ed8ce0d7183.jpeg?im_w=720', 'https://a0.muscache.com/im/pictures/prohost-api/Hosting-43904489/original/52189202-1719-4790-a667-27ae6e81fb99.jpeg?im_w=720', 'https://a0.muscache.com/im/pictures/prohost-api/Hosting-43904489/original/da0587cb-902e-47f7-8521-92dfab60930d.jpeg?im_w=720']"
Goiás,1006775443535314039,Ipê Azul. Moderna casa container,Contêiner de transporte em Brasília,entire_home,785,4.88,52,-15.81927260137192,-47.766948106423946,Preferido dos hóspedes,"Dê as boas-vindas à Casa Ipê Azul!<br /><br />Esta casa container foi cuidadosamente projetada para oferecer conforto, conveniência e uma conexão íntima com a natureza.<br /><br />Perfeita para casais e grupos em busca de um refúgio ao ar livre, a uma curta distância da cidade.<br /><br />Desfrute de varandas, terraço e ambientes integrados que proporcionam uma ampla vista para a exuberante vegetação preservada.","['2 camas', '2 quartos', '2 banheiros', 'Ar-condicionado', 'Wi-Fi', 'Estacionamento gratuito', 'Cozinha', 'A limpeza recebeu uma avaliação de 4,9 estrelas, de um máximo de 5']","['https://a0.muscache.com/im/pictures/miso/Hosting-1006775443535314039/original/95cc1682-6659-43eb-819f-ba24bad1cca4.jpeg?im_w=720', 'https://a0.muscache.com/im/pictures/miso/Hosting-1006775443535314039/original/08249a6b-79b0-4612-a2af-0e2aab515b0b.jpeg?im_w=720', 'https://a0.muscache.com/im/pictures/miso/Hosting-1006775443535314039/original/8ef84480-8f02-4e73-aefc-9d9354d0a24b.jpeg?im_w=720', 'https://a0.muscache.com/im/pictures/miso/Hosting-1006775443535314039/original/31032332-44bc-48d5-a5d3-62e54da67f72.jpeg?im_w=720', 'https://a0.muscache.com/im/pictures/miso/Hosting-1006775443535314039/original/0ca2c336-d85b-43bd-a2a1-89c2b71dac3e.jpeg?im_w=720', 'https://a0.muscache.com/im/pictures/miso/Hosting-1006775443535314039/original/2c1bec5e-ba04-4990-b28a-c42a3fef52ff.jpeg?im_w=720']"
Goiás,853063400602518658,Chalé Rústico,Cabana em Goias,entire_home,363,4.89,115,-15.596648495589193,-48.215764495236236,Preferido dos hóspedes,"Venha desfrutar de um espaço rústico em meio à natureza para contemplar dias de sossego e tranquilidade. <br /><br />Localizado na Vendinha-GO, a 8km de Brazlândia, o Chalé Portal do Cerrado é privativo e possui cozinha equipada, smart TV, wifi e piscina. Possui capacidade para até 4 pessoas (temos uma cama queen e um sofá cama).<br /><br />Oferecemos toalhas, roupa de cama e utensílios de cozinha (não servimos café da manhã ou almoço).<br /><br />Check in - 14h<br />Check out - 11h<br /><br />Venha viver essa experiência!","['2 camas', '1 quarto', '1 banheiro', '1 cama queen', '1 sofá-cama', 'Wi-Fi', 'Cozinha']","['https://a0.muscache.com/im/pictures/miso/Hosting-853063400602518658/original/b780c901-a95c-477a-a784-97197f5eecf7.jpeg?im_w=720', 'https://a0.muscache.com/im/pictures/miso/Hosting-853063400602518658/original/ca2057c9-3e02-44d3-8955-5819671dffbe.jpeg?im_w=720', 'https://a0.muscache.com/im/pictures/miso/Hosting-853063400602518658/original/380b328b-06dc-4a70-a389-173ab21c2172.jpeg?im_w=720', 'https://a0.muscache.com/im/pictures/miso/Hosting-853063400602518658/original/cdefdfa1-89f3-4360-b9ed-ca14701c5b95.jpeg?im_w=720', 'https://a0.muscache.com/im/pictures/2ecbd7ad-1c4f-4fed-9758-ebc231cc05a6.jpg?im_w=720', 'https://a0.muscache.com/im/pictures/miso/Hosting-853063400602518658/original/c4209176-734f-4674-abf8-7fb7cec81981.jpeg?im_w=720']"
Goiás,770139440080427157,Chalé Recanto Uruá - com Ofurô,Casa em Alto Paraíso de Goiás,entire_home,417,4.98,87,-14.12119,-47.51927,Preferido dos hóspedes,"Lindo Chalé com Ofurô, super bem localizado, perfeito para quem gosta de tranquilidade e a aproximadamente 7 minutos da avenida principal. <br /><br />Nosso espaço é pensado para experiências em casal, com vários cantinhos aconchegantes, cheio de detalhes que fazem toda a diferença.<br /><br />Terreno totalmente cercado, proporcionando mais privacidade, e pertinho da avenida principal. <br /><br />•Cama Queen<br />•Ôfuro<br />•Wi-fi<br />•Ventilador<br />• Secador de cabelo<br />• Cafeteira<br />• Travesseiros extra<br /><br /><b>O espaço</b><br />O espaço foi pensando e construído pelo casal de proprietários, com a intenção de propiciar experiências românticas e especiais.<br />Cada cantinho é cheio de detalhes, com muitos espaços confortáveis para ficar. É um Chalé com arquitetura diferenciada, toda estrutura e detalhes em bambu, dando um ar especial e um viés sustentável pra construção.<br /><br />O dormitório no mezanino conta com uma varanda com vista, conectada a copa de uma árvore, um espaço muito gostoso de ficar, com vista pro nascer do sol. <br /><br />No primeiro andar há um deck amplo, com Ofurô com água quentinha e hidromassagem. O deck é perfeito para prática de yoga e outras atividades, ou tomar um café gostoso curtindo o sol da manhã. <br /><br />A sala e cozinha são super integrados, com uma cozinha bem equipada, com tudo que se precisa. Na sala temos um sofá fixo amplo muito confortável.<br /> <br />O banheiro é um charme, com paredes redondas, painel de bambu na frente da pia, bancada em madeira, espelho grande, iluminação bacana e chuveiro quentinho. <br /><br />É uma verdadeira experiência romântica em uma acomodação muito especial!<br /><br /><b>Acesso do hóspede</b><br />Pátio totalmente cercado e privativo, com vaga para estacionar dentro. <br />Deck com ofurô com painéis ao redor dando privacidade. <br />Área para fogueira.<br /><br /><b>Outras observações</b><br />• INTERNET - A internet é de fibra ótica de 450 mega. <br /><br />•CAFE DA MANHA  -  Você pode incluir um café da manha em sua estadia por um pacote pago a parte e acertado diretamente.","['1 cama', '1 quarto', '1 banheiro', 'Wi-Fi', 'Estacionamento gratuito', 'Cozinha', 'A limpeza recebeu uma avaliação de 4,9 estrelas, de um máximo de 5']","['https://a0.muscache.com/im/pictures/miso/Hosting-770139440080427157/original/cba1827c-127e-4b50-ab8f-566563af1c7b.jpeg?im_w=720', 'https://a0.muscache.com/im/pictures/miso/Hosting-770139440080427157/original/aab7409b-fdbd-449d-b418-c2d61d2b9f7f.jpeg?im_w=720', 'https://a0.muscache.com/im/pictures/hosting/Hosting-U3RheVN1cHBseUxpc3Rpbmc6NzcwMTM5NDQwMDgwNDI3MTU3/original/9ee59421-4590-442b-9461-76e95eea5d7b.jpeg?im_w=720', 'https://a0.muscache.com/im/pictures/miso/Hosting-770139440080427157/original/68be966f-ea50-466c-96f2-71f7633bb124.jpeg?im_w=720', 'https://a0.muscache.com/im/pictures/64afcffd-710c-42aa-953e-48decbd0863c.jpg?im_w=720', 'https://a0.muscache.com/im/pictures/hosting/Hosting-U3RheVN1cHBseUxpc3Rpbmc6NzcwMTM5NDQwMDgwNDI3MTU3/original/83c568f5-da11-4d82-81a1-43db03f01860.jpeg?im_w=720']"
Goiás,562966344709213640,Quinta dos Goyaze Boutique Piri @quintadosgoyaze,Casa de veraneio em Pirenópolis,entire_home,1216,4.95,220,-15.82118,-48.89292,Preferido dos hóspedes,"Exclusividade, privacidade, sossego em meio a natureza e muito, muito conforto. Ingredientes que fazem do Quinta dos Goyazes Eco Boutique uma experiência única em Pirenópolis para quem ama escapar do barulho, explorar a natureza em um eco boutique cheio de charme.<br /><br /><b>O espaço</b><br />O chalé conta com cozinha gourmet completa, cama king size e enxovais de 600 fios, piscina aquecida por placa solar, banheiro privativo, área de serviço com máquina de lavar, copa com mesa para refeições.<br /><br /><b>Acesso do hóspede</b><br />Todos dentro da propriedade.<br /><br /><b>Outras observações</b><br />O aquecimento da piscina é feito por placa solar. Portanto, a temperatura da água pode variar dependendo da intensidade dos raios solares e da época do ano.","['1 banheiro', '1 cama king', 'Ar-condicionado', 'Wi-Fi', 'Estacionamento gratuito', 'Cozinha', 'A limpeza recebeu uma avaliação de 4,9 estrelas, de um máximo de 5']","['https://a0.muscache.com/im/pictures/4e1493b8-30b2-4de7-8b9b-407bb27e75d6.jpg?im_w=720', 'https://a0.muscache.com/im/pictures/a0b2ac04-22fc-4d56-8244-41a2dced2ef1.jpg?im_w=720', 'https://a0.muscache.com/im/pictures/7c866483-6439-42e6-b00c-0dbd002217d0.jpg?im_w=720', 'https://a0.muscache.com/im/pictures/miso/Hosting-562966344709213640/original/7d376d03-de75-46da-9a94-a6507e38299e.jpeg?im_w=720', 'https://a0.muscache.com/im/pictures/afc7a663-6012-4bc7-9494-06c6f647a411.jpg?im_w=720', 'https://a0.muscache.com/im/pictures/miso/Hosting-562966344709213640/original/13ba6833-4030-4ed7-af2e-dc7828b9e185.jpeg?im_w=720']"
